{
  "schema_version": "learning-status.v1",
  "status": "warmup",
  "model_version": "opening-v1",
  "verified_days": 0,
  "required_days": 20,
  "stats": null,
  "confidence_breakdown": {},
  "pending_proposal": null,
  "manual_pause_remaining_days": 0,
  "last_change": null,
  "message": "學習資料累積中，滿 20 個已驗證交易日後才顯示正式統計"
}
